"","ix","guess"
"1",113,"I'm not 100 percent sure. With only one example and no way to know if you chose correctly, it's just a guess to be honest."
"2",141,"shape remains the same , purple to yellow"
"3",145,"A ai robot."
"4",147,"Shape doesn't change.
Red turns purple yellow.
"
"5",150,"Touching a magic stone to a regular stone changes it's color"
"6",155,"I think it changes the object to the other color that is not represented. "
"7",158,"i assumed it was simply cycling colors but only got 2 data points so it was a complete guess as trying to figure out a pattern with 2 very similar examples is impossible"
